{
  "schemaVersion": "1.0.0",
  "bundleId": "bundle-synthetic-paused-001",
  "assetId": "asset-portfolio-synthetic-one",
  "revision": 1,
  "packageVersion": "26.9.6",
  "generatedAt": "2026-07-27T00:00:00+08:00",
  "asOf": "2026-07-27T00:00:00+08:00",
  "parkBrief": {
    "schemaVersion": "1.0.0",
    "contextKind": "park_bound_task",
    "taskContextId": "task-context-park-synthetic-public",
    "parkId": "park-synthetic-public",
    "parkName": "合成演示园区",
    "location": {
      "country": "中国",
      "province": "示例省",
      "city": "示例市",
      "district": null
    },
    "operatorType": "市场化园区运营商",
    "parkArchetypes": [
      "产业孵化基地"
    ],
    "developmentStage": "成长期",
    "mission": {
      "statement": "寻找一家能够补齐设备状态监测链节的合格企业",
      "basisState": "user_stated",
      "basisRefs": [
        "input-receipt-current-request"
      ],
      "authority": "context_only_non_normative"
    },
    "timeHorizon": "本轮任务",
    "industryFocus": [
      "智能制造"
    ],
    "chainGaps": [
      "设备状态监测"
    ],
    "spaceAndFacility": [],
    "resourceAdvantages": [
      "本地制造企业场景资源"
    ],
    "hardConstraints": [],
    "softPreferences": [],
    "knownFacts": [],
    "assumptions": [],
    "blockingUnknowns": [],
    "adaptationContext": {
      "profileVersion": "adaptive-context-1.0.0",
      "factors": [
        {
          "factorId": "chain-gap",
          "label": "产业链缺口",
          "state": "user_stated",
          "applicability": "applicable",
          "summary": "当前任务只需要核验设备状态监测链节",
          "evidenceRefs": []
        }
      ],
      "routingFactorIds": [
        "chain-gap"
      ],
      "contextCompleteness": "minimum_sufficient"
    },
    "taskGoal": {
      "schemaVersion": "1.0.0",
      "goalId": "goal-synthetic-one",
      "goalRevision": 1,
      "goalStatus": "frozen",
      "goalMode": "explicit_count",
      "candidateQualificationApplicability": "applicable",
      "goalSource": "user_explicit",
      "basisReceiptSnapshotHash": "ee0c0e5f8ad6c25d80e136dc354644b723663c82e8707bd972a24799447badfd",
      "searchScope": {
        "scopeMode": "open",
        "scopeId": null,
        "universeType": null,
        "expectedCount": null,
        "universeBindings": [],
        "universeSnapshotHash": null,
        "scopeHash": "3f69459bda5d6101db4f146900605d4aabbafc0cf16bfa67381d99a21d778222",
        "basisRefs": [
          "input-receipt-current-request"
        ],
        "universeManifest": null
      },
      "countRequirement": {
        "relation": "exact",
        "exactCount": 1,
        "minimumCount": null,
        "maximumCount": null,
        "basisRefs": [
          "input-receipt-current-request"
        ],
        "supportState": "supported",
        "numberPurpose": "task_total",
        "referenceCount": null
      },
      "requestedQualifiedCount": 1,
      "coverageRequirements": [],
      "qualificationCriteria": [
        {
          "criterionId": "criterion-device-monitoring",
          "statement": "企业具备设备状态监测能力且有可回读公开证据",
          "required": true,
          "basisState": "user_stated",
          "evidenceTemporalRequirement": "current_state",
          "basisRefs": [
            "input-receipt-current-request"
          ],
          "decisionRule": {
            "ruleType": "qualitative_judgment",
            "claimPredicates": [
              "provides_capability"
            ],
            "expectedEntailment": "supports",
            "operator": null,
            "expectedValue": null,
            "resultMapping": {
              "whenTrue": "pass",
              "whenFalse": "fail",
              "whenIndeterminate": "unknown",
              "whenNotApplicable": "not_applicable"
            },
            "operandValueType": null,
            "expectedNormalizedValue": null,
            "unit": null,
            "normalization": null
          }
        }
      ],
      "completionAuthority": "structured_goal_fields_only",
      "acceptanceCriteria": [
        "交付恰好1家满足全部必选资格标准的去重合格企业。"
      ],
      "unsupportedCompletionConditions": [],
      "blockingGoalUnknowns": [],
      "frozenAt": "2026-07-27T00:00:00+08:00",
      "goalHash": "6f3cb31c0f64eb29f5900e91c90cda6cc259fbf8e8c254388e0d4c4fcbfd0d42",
      "supersedesGoalRef": null,
      "prioritizationCriteria": [],
      "evaluationRequirement": {
        "mode": "none",
        "scopeHash": null,
        "completionRule": "not_applicable"
      },
      "deliveryEligibilityMode": "qualification_only",
      "deliveryCriteria": [],
      "taskDeliverableRequirements": []
    },
    "batchPolicy": {
      "deliveryBatchSize": 1,
      "firstVisibleBatchSize": 0,
      "batchSizeSource": "user_explicit",
      "batchUnit": "visible_items",
      "capacityAllocation": "shared_candidate_and_assessment_items",
      "batchSizeAuthorityState": "user_input_receipt",
      "batchSizeBasisRefs": [
        "input-receipt-current-request"
      ]
    },
    "publicSourcePolicy": "public_only",
    "researchBudget": {
      "mode": "provided-material",
      "budgetSource": "no_explicit_cap",
      "timeBudgetMinutes": null,
      "maxQueries": null,
      "maxRetriesPerSource": null,
      "coverageSearchStateBudget": null,
      "coverageSearchStateBudgetSource": "no_explicit_cap",
      "coverageSearchStateBudgetEffect": "algorithm_checkpoint_only_never_goal_shortfall",
      "budgetEffect": "pause_checkpoint_not_market_shortfall",
      "budgetAuthorityState": "not_applicable",
      "budgetBasisRefs": [],
      "coverageSearchStateBudgetAuthorityState": "not_applicable",
      "coverageSearchStateBudgetBasisRefs": []
    },
    "constraintHash": "190e1b143b9e43b6352e2fb346819a91ee6421a1ba30037b1273aa2a825c045c",
    "inputReceipts": [
      {
        "receiptId": "input-receipt-current-request",
        "sourceKind": "current_turn",
        "redactedSummary": "用户明确本轮园区、产业方向、业务总量与合格资格要求。",
        "normalizedContentHash": "6556bc8a2315b93ddfcb29c6dd1ac8c9cde2e01d8d5dcc4d08a2a47dd62b3283",
        "sessionBindingHash": "b159b5d8d93006ad63aff6a4e17e1b2971874d06ea5edc443ca084cb65517e81",
        "turnBindingHash": "1e09053a40462aa456eb92f84513192b3ef88609b01553267534a9a784690ecf",
        "recordedAt": "2026-07-27T00:00:00+08:00",
        "confirmationState": "explicit",
        "trustState": "synthetic_fixture_assumption",
        "authorizationState": "not_proven_by_business_payload"
      }
    ],
    "inputReceiptSnapshotHash": "ee0c0e5f8ad6c25d80e136dc354644b723663c82e8707bd972a24799447badfd"
  },
  "portfolio": {
    "schemaVersion": "1.0.0",
    "packageVersion": "26.9.6",
    "portfolioId": "portfolio-synthetic-one",
    "assetId": "asset-portfolio-synthetic-one",
    "revision": 1,
    "previousRevisionRef": null,
    "createdAt": "2026-07-27T00:00:00+08:00",
    "updatedAt": "2026-07-27T00:00:00+08:00",
    "asOf": "2026-07-27T00:00:00+08:00",
    "parkBriefRef": "examples/portfolio-evidence-bundle.example.json#/parkBrief",
    "parkConstraintHash": "190e1b143b9e43b6352e2fb346819a91ee6421a1ba30037b1273aa2a825c045c",
    "evidenceSnapshotHash": "5eb4a46f8df5a0d96b8a61f67a7c3fa8d1dc8abf95ab2ca31b88ed2dae7a1868",
    "changeSet": {
      "addedCandidateRefs": [
        "candidate-synthetic-001"
      ],
      "removedCandidateRefs": [],
      "rankChangedCandidateRefs": [],
      "statusChangedCandidateRefs": [],
      "evidenceChangedCandidateRefs": [],
      "changeSummary": "首次形成一个合格候选的合成示例。"
    },
    "evidenceBundleRef": "examples/portfolio-evidence-bundle.example.json",
    "queryLedgerRef": "examples/portfolio-evidence-bundle.example.json#/queryLedger",
    "taskGoal": {
      "schemaVersion": "1.0.0",
      "goalId": "goal-synthetic-one",
      "goalRevision": 1,
      "goalStatus": "frozen",
      "goalMode": "explicit_count",
      "candidateQualificationApplicability": "applicable",
      "goalSource": "user_explicit",
      "basisReceiptSnapshotHash": "ee0c0e5f8ad6c25d80e136dc354644b723663c82e8707bd972a24799447badfd",
      "searchScope": {
        "scopeMode": "open",
        "scopeId": null,
        "universeType": null,
        "expectedCount": null,
        "universeBindings": [],
        "universeSnapshotHash": null,
        "scopeHash": "3f69459bda5d6101db4f146900605d4aabbafc0cf16bfa67381d99a21d778222",
        "basisRefs": [
          "input-receipt-current-request"
        ],
        "universeManifest": null
      },
      "countRequirement": {
        "relation": "exact",
        "exactCount": 1,
        "minimumCount": null,
        "maximumCount": null,
        "basisRefs": [
          "input-receipt-current-request"
        ],
        "supportState": "supported",
        "numberPurpose": "task_total",
        "referenceCount": null
      },
      "requestedQualifiedCount": 1,
      "coverageRequirements": [],
      "qualificationCriteria": [
        {
          "criterionId": "criterion-device-monitoring",
          "statement": "企业具备设备状态监测能力且有可回读公开证据",
          "required": true,
          "basisState": "user_stated",
          "evidenceTemporalRequirement": "current_state",
          "basisRefs": [
            "input-receipt-current-request"
          ],
          "decisionRule": {
            "ruleType": "qualitative_judgment",
            "claimPredicates": [
              "provides_capability"
            ],
            "expectedEntailment": "supports",
            "operator": null,
            "expectedValue": null,
            "resultMapping": {
              "whenTrue": "pass",
              "whenFalse": "fail",
              "whenIndeterminate": "unknown",
              "whenNotApplicable": "not_applicable"
            },
            "operandValueType": null,
            "expectedNormalizedValue": null,
            "unit": null,
            "normalization": null
          }
        }
      ],
      "completionAuthority": "structured_goal_fields_only",
      "acceptanceCriteria": [
        "交付恰好1家满足全部必选资格标准的去重合格企业。"
      ],
      "unsupportedCompletionConditions": [],